lexeme_id,ex_zhh,ex_zhh_pron,ex_chs,ex_en
L1,掉/丢垃圾,,扔垃圾,throw away the trash / garbage
L1,揼垃圾,,扔垃圾，把东西扔掉,take out the trash
L1,擗埋一边,,扔在一边，随意不经意扔,put aside，set aside
L1,飞...过离,,扔一样东西来，扔过来速度很快,hurl / fling
L1,挞落地下,,扔在底上，很大力往下扔,Drop it down. / Throw it down.
L1,抛垃圾,,扔垃圾，形容有抛物线同时也是随意扔,lob it into the trash
L2,死撑,,錯了或沒有能力的情況下，仍然強硬地堅持不認輸或不肯承認錯誤，帶有固執、不願罷休的意味,To stubbornly refuse to admit defeat or acknowledge mistakes when one is wrong or incapable of doing so carries a connotation of obstinacy and unwillingness to give up.
